page_name,user_name,facebook_id,page_category,page_admin_top_country,page_description,page_created,likes_at_posting,followers_at_posting,post_created,post_created_date,post_created_time,type,total_interactions,likes,comments,shares,love,wow,haha,sad,angry,care,video_share_status,is_video_owner,post_views,total_views,total_views_for_all_crossposts,video_length,url,message,link,final_link,image_text,link_text,description,sponsor_id,sponsor_name,sponsor_category,overperforming_score_weighted_likes_1x_shares_1x_comments_1x_love_1x_wow_1x_haha_1x_sad_1x_angry_1x_care_1x,message_contains_crt,message_contains_critical_race_theory
Francis Howell School District,francishowellschools,708726049256854,PUBLIC_SCHOOL,US,Francis Howell School District encompasses over 150 square miles in the southeast corner of St. Charles County and is one of the largest districts in Mo.,2015-06-08T13:33:45Z,17718,18520,2021-09-08 09:39:27 EDT,2021-09-08,09:39:27,Live Video Scheduled,17,9,8,0,0,0,0,0,0,0,NA,-,0,0,0,N/A,https://www.facebook.com/708726049256854/posts/252688153399107,NA,https://www.facebook.com/events/252688153399107/,NA,NA,Appliance & Electronics Recycling Event,"Francis Howell School District in partnership with Nilo-Tech E-Cycling presents the annual Appliance & Electronics Recycling Event. 

Acceptable items (working or not)*: 
air conditioners, answering machines, cameras, cell phones, computer monitors, copiers, dehumidifiers, dishwashers, dryers, DVDs, fans, fax machines, furnaces, gaming systems, hairdryers, hard drives, humidifiers, keyboards, kitchen appliances, laptops, lawn equipment, microwaves, printers, power tools, radios, refrigerators, remotes, satellite receivers, scanners, speakers, stereos, TVs, vacuum cleaners, VCRs, water heaters, washers. 


*Additional information:
- $5 disposal fee for CRT monitors
- hard drives are wiped or destroyed, $5 fee is charged if a certificate of  destruction is required 
- lawn and garden equipment must have oil and gas emptied
- TV disposal fees: $30 for TVs up to 26"", $50 for TVs over 27"", and $50 for any size rear-projection or console TVs",NA,NA,NA,-4.53,NA,NA
Stark County CUSD 100,SCCUSD100,322676618110440,PUBLIC_SCHOOL,US,Stark County CUSD #100 is consolidation of the former Unit District of Toulon/LaFayette and the former High School and Elementary Districts of Wyoming.,2016-10-13T17:49:00Z,2148,2421,2021-09-03 17:15:44 EDT,2021-09-03,17:15:44,Link,6,4,1,1,0,0,0,0,0,0,NA,-,0,0,0,N/A,https://www.facebook.com/322676618110440/posts/1498302857214471,"Check out our Weekly Parent Update from Mr. Elliott #leveluprebelup #PrideandExcellence Good afternoon Rebels, This is your proud Superintendent, Mr. Elliott, with your weekly update for Friday September 3, 2021. Congratulations: Congratulations the Stark County Board of Education who has been selected for the 2021 IASB School Governance Recognition for Excellence in School Board Leadership. The SC Board of Education will be honored later this fall. We want to thank the current and former board leadership for the great accomplishment: Ann Orwig, Bruce West, Brian Rewerts, Dave Steward, Beth Rumbold, Matthew Nagode, Emily Holman and Erin Price. Sex Education and Critical Race Theory Legislation: In regards to recent Illinois Legislation for Sex Education Curriculum and political topic of the Critical Race theory, here is an update in regards to Stark County: 1) New Sex Education: Per the new legislation and ROE, the sex education changes are ONLY for school boards who want to opt into the new expanded curriculum. A school board may choose to stay with our current sex education curriculum. Currently, Stark County Board of Education will not pursue any sex education curriculum changes. 2). The Critical Race Theory is a post graduate level study, not mandated curriculum, that was created at Harvard University. With that stated, the most recent Illinois social studies/history legislation is an “opts school boards can create new courses that focus on Black Lives Matter, Black History, etc. The only requirement curriculum change is to ensure a level Asian American History is taught, which is already in our textbooks/curriculum. Parking: With feedback from the community, we will continue the tradition of allowing parking at home football games at Gary Johnson field. We ask that you enter by 6:30 pm to avoid traffic inside the gates for safety reasons and also allow all foot traffic to exit the stadium before moving your vehicles. Due to a water line repair, all spectators for tonight’s game will enter and pay at the north or south gate. The new middle gate is currently closed. COVID-19 Protocols and On-Site Testing: A reminder to view our COVID-19 protocols for contact tracing and quarantine/isolation posted on our website @stark100. We remind you that options 2-4 are only available if you follow the health departments guidelines of daily check-ins via text or app once placed into COVID isolation or healthy Quarantine. If these daily contacts with the Health Department are not made the time out of school will be 14 days. We are also offering on-site Binax-NOW rapid testing to staff and students in our nurses’ offices if you have a parent consent form on file and opt into Option 4, “Test to Stay” Protocols. Please contact your school for any questions. https://drive.google.com/file/d/11-dWmZiHll-pgfjFpHjZARrI7E7VR67n/view?usp=sharing SC Sportsmanship: As we enter the new year and full athletics seasons, we remind you that here at Stark County we take great pride in representing our schools and communities with good sportsmanship. Please avoid yelling or criticizing players, coaches, officials or programs during games and practices. Also, please use social media to promote our programs in a positive way. The world is filled with negativity, so let’s take the high road and remain positive Stark County. Live Broadcasts Sponsorships and Reserved Football Seating Available: With the pandemic continuing to affect our lives, Stark County will again have live broadcasts of varsity volleyball, football and boys/girls basketball with announcers presenting football and basketball. In order to fund this initiative, we are seeking game sponsors. If your family or business is interested, please check out the criteria for Gold, Silver and Bronze sponsorships posted today on our Facebook and contact me at belliott@stark100.com or 309-695-6123 to participate in sponsorships. We also have our reserved “Red Chair” seating available for home football games. There are still Red Football seats available for purchase at the Gary Johnson Football Field in Wyoming. Cost is $50 each, if interested please contact the HS office. COVID-19 Health Update for August 29 – September 3: • 1 COVID-19 Positive Student Cases (SCES) • 1 Student close contact (SCES, entered into “Test to Stay” protocol) • 0 Staff Cases or Quarantines Principal’s Weekly Updates: A reminder to listen and read your weekly principal updates from Mrs. Bibb and Ms. McGann to prepare you and your children for the week ahead including the SCJSH Open House on Thursday and the full 2021 Homecoming week including event night, bonfire, parade, dance and more! As always, thank you for being the Pride and Excellence of Stark County. Bookshakalaka, take the on a rare….Sunday!!! #LevelUpRebelUp -Mr. Elliott",https://drive.google.com/file/d/11-dWmZiHll-pgfjFpHjZARrI7E7VR67n/view?usp=sharing,NA,NA,Parent COVID Consent To Testing SC100 Draft.pdf,NA,NA,NA,NA,-0.6,FALSE,TRUE
PrescotteNews,eNewsAZ,116617135041809,NEWS_SITE,US,"Local, State, and National News, Politics for Prescott, Prescott Valley, Chino Valley, Dewey, Mayer, Arizona 

Founded in 2007, the recipient of multiple awards, including the Arizona Press Club Award, Prescott Unified School District, AZ Farm Bureau.",2010-05-12T21:01:01Z,15144,16520,2021-08-31 16:18:13 EDT,2021-08-31,16:18:13,Photo,7,2,2,0,0,0,3,0,0,0,NA,-,0,0,0,N/A,https://www.facebook.com/116617135041809/posts/4263558953680919,"Former AG Tom Horne, Candidate for State Superintendent for Public Instruction, to Speak on Critical Race Theory | Prescott eNews https://bit.ly/3zCb0Jx",https://www.facebook.com/eNewsAZ/photos/a.184907864879402/4263558833680931/?type=3,NA,NA,NA,NA,NA,NA,NA,-3.71,FALSE,TRUE
Pathways in Technology Early College High School,PathwaysInTech,100063576491028,PERSON,US,P-TECH is a new and very different type of school that brings together the best elements of high sch,2011-02-02T20:49:42Z,2229,2359,2021-08-31 05:02:54 EDT,2021-08-31,05:02:54,Link,0,0,0,0,0,0,0,0,0,0,NA,-,0,0,0,N/A,https://www.facebook.com/188958387795892/posts/6296065673751769,NA,https://clarion.causeaction.com/2021/08/31/p-tech-is-a-race-neutral-education-movement-the-counters-critical-race-theory-it-works-and-its-in-peril/,NA,NA,P-TECH Is a Race-Neutral Education Movement the Counters Critical Race Theory. It Works. And It’s in Peril.,"Michael Landsbaum hit bottom after his father lost his job and couldn’t pay rent, leaving the teenager homeless in Dallas. He slept on friends’ couches for months until he was rescued by an unlikel…",NA,NA,NA,-26,NA,NA
Canon City Schools Fremont RE-1,canoncityschoolsre1,239600186140492,PUBLIC_SCHOOL,US,Canon City School District Fremont RE-1,2012-05-15T03:44:38Z,3610,3896,2021-08-30 16:13:35 EDT,2021-08-30,16:13:35,YouTube,38,25,5,8,0,0,0,0,0,0,NA,-,0,0,0,N/A,https://www.facebook.com/239600186140492/posts/3762601983840277,"In this video, CCSD Superintendent of Schools George Welsh and Superintendent Designee Adam Hartman share a conversation about Critical Race Theory and its impact on the Cañon City School District. By watching, you will again in your understanding of what Critical Race Theory is, whether CCSD teaches it, and what CCSD is doing to support high-quality education for students steeped in fairness and kindness. https://www.youtube.com/watch?v=TVjzFSr68E8",https://www.youtube.com/watch?v=TVjzFSr68E8,NA,NA,Cañon City Schools and Critical Race Theory,"In this video, CCSD Superintendent of Schools George Welsh and Superintendent Designee Adam Hartman share a conversation about Critical Race Theory and its i...",NA,NA,NA,1.46,FALSE,TRUE
Salem-Keizer Public Schools,salemkeizerschools,60676476121,PERSON,US,"At Salem-Keizer Public Schools, our vision is all students graduate and are prepared for a successfu",2009-03-23T15:25:28Z,17461,19183,2021-08-26 14:08:59 EDT,2021-08-26,14:08:59,Link,92,54,12,7,13,2,0,1,3,0,NA,-,0,0,0,N/A,https://www.facebook.com/60676476121/posts/10159937146166122,"Assistant Superintendent Iton Udosenata spoke with KGW-TV about the teaching of critical race theory. “What we really try to do is celebrate race and ethnic diversity within our schools,” Udosenata said. Learn more: https://www.kgw.com/article/news/education/salem-keizer-race-diversity/283-af34eb62-dc83-48b8-9a72-ae3b7188bdef?utm_campaign=snd-autopilot",https://www.kgw.com/article/news/education/salem-keizer-race-diversity/283-af34eb62-dc83-48b8-9a72-ae3b7188bdef?utm_campaign=snd-autopilot,NA,NA,Salem-Keizer Public Schools talks race and diversity in classrooms,"District leaders said curriculum does not include a deep dive into critical race theory, but topics may be influenced by the concept.",NA,NA,NA,2.09,FALSE,TRUE
Pittsford Central School District,PittsfordCentralSchoolDistrict,185850194793977,PUBLIC_SCHOOL,US,The official Facebook page of the Pittsford Central School District.,2011-04-19T15:09:36Z,2517,2861,2021-08-25 12:01:38 EDT,2021-08-25,12:01:38,Link,6,1,0,5,0,0,0,0,0,0,NA,-,0,0,0,N/A,https://www.facebook.com/185850194793977/posts/4234887569890199,"Join Us for Community Forums on Curriculum Updates Assistant Superintendent for Instruction Melanie Ward will be sharing the NYSED Culturally Responsive-Sustaining Framework and recent updates to Pittsford’s K-12 English/language arts and social studies curriculum at the following events: Secondary Curriculum Review for Grades 6-12 TOMORROW, August 26, 6:30-7:30pm at Calkins Road Middle School, commons Culturally Responsive-Sustaining Education is not the same as Critical Race Theory Culturally Responsive-Sustaining Education is a research-based, NYSED required approach to how we interact in the classroom, in an attempt to connect with each student and help create an environment where everyone reaches their full potential. Critical Race Theory is a term that is being used a lot recently, but is not being taught in our schools. Critical Race Theory is about challenging historical approaches to the teaching of topics connected to race. It is a social and legal construct, typically discussed in university settings. Join us to learn more about the NYSED framework and PCSD curriculum updates by registering here: https://www.pittsfordschools.org/Page/25783. ASL interpretation services will be provided during the events. The forums will be recorded and posted on the PCSD YouTube page.",https://www.pittsfordschools.org/Page/25783,NA,NA,Curriculum & Instruction / Parent Forums on Curriculum Updates,Assistant Superintendent for Instruction Melanie Ward will be sharing the NYSED Culturally Responsive-Sustaining Framework and recent updates to Pittsford’s K-12 English/language arts and social studies curriculum at the following events: ,NA,NA,NA,-0.62,FALSE,TRUE
Pittsford Central School District,PittsfordCentralSchoolDistrict,185850194793977,PUBLIC_SCHOOL,US,The official Facebook page of the Pittsford Central School District.,2011-04-19T15:09:36Z,2517,2860,2021-08-24 09:01:08 EDT,2021-08-24,09:01:08,Link,6,3,2,1,0,0,0,0,0,0,NA,-,0,0,0,N/A,https://www.facebook.com/185850194793977/posts/4231372743575015,"Join Us for Community Forums on Curriculum Updates Assistant Superintendent for Instruction Melanie Ward will be sharing the NYSED Culturally Responsive-Sustaining Framework and recent updates to Pittsford’s K-12 English/language arts and social studies curriculum at the following events: Elementary Curriculum Review for Grades K-5 TODAY, August 24, 6:30-7:30pm at Calkins Road Middle School, commons Secondary Curriculum Review for Grades 6-12 Thursday, August 26, 6:30-7:30pm at Calkins Road Middle School, commons Culturally Responsive-Sustaining Education is not the same as Critical Race Theory Culturally Responsive-Sustaining Education is a research-based, NYSED required approach to how we interact in the classroom, in an attempt to connect with each student and help create an environment where everyone reaches their full potential. Critical Race Theory is a term that is being used a lot recently, but is not being taught in our schools. Critical Race Theory is about challenging historical approaches to the teaching of topics connected to race. It is a social and legal construct, typically discussed in university settings. Join us to learn more about the NYSED framework and PCSD curriculum updates by registering here: https://www.pittsfordschools.org/Page/25783. ASL interpretation services will be provided during the events. The forums will be recorded and posted on the PCSD YouTube page.",https://www.pittsfordschools.org/Page/25783,NA,NA,Curriculum & Instruction / Parent Forums on Curriculum Updates,Assistant Superintendent for Instruction Melanie Ward will be sharing the NYSED Culturally Responsive-Sustaining Framework and recent updates to Pittsford’s K-12 English/language arts and social studies curriculum at the following events: ,NA,NA,NA,-0.62,FALSE,TRUE
Big Picture Learning,bigpicturelearning,387594117963004,NON_PROFIT,US,"Our mission is to activate the potential of schools, systems, and education through student-driven, real-world learning.",2012-07-30T19:27:21Z,4523,4865,2021-08-23 11:52:42 EDT,2021-08-23,11:52:42,Link,10,7,1,2,0,0,0,0,0,0,NA,-,0,0,0,N/A,https://www.facebook.com/387594117963004/posts/4233895116666199,You do not want to miss this discussion! Featuring plenty of BPL friends and family. Register today. Join next week!,https://bit.ly/2XlnfvV,https://us02web.zoom.us/webinar/register/2316287179173/WN_T3GC3sgORXmy81mlfwE8pg,NA,This is a re-share of a post,"As educators head back to classrooms, some are facing fierce community & legislative debates about what to teach. How do funders fit into this critical race theory debate? What does it mean for teachers and students? Join us 9/1: https://bit.ly/2XlnfvV:=:https://us02web.zoom.us/webinar/register/2316287179173/WN_T3GC3sgORXmy81mlfwE8pg

With Sara Sneed of @The NEA Foundation , Nancy Gutierrez of The Leadership Academy, Jonathan Zimmerman of Penn Graduate School of Education , and teacher Matthew Becerra and student Sofia Ervin of San Diego Met High school",NA,NA,NA,-0.17,FALSE,FALSE
Pittsford Central School District,PittsfordCentralSchoolDistrict,185850194793977,PUBLIC_SCHOOL,US,The official Facebook page of the Pittsford Central School District.,2011-04-19T15:09:36Z,2516,2857,2021-08-23 09:55:02 EDT,2021-08-23,09:55:02,Link,4,2,1,1,0,0,0,0,0,0,NA,-,0,0,0,N/A,https://www.facebook.com/185850194793977/posts/4228493867196236,"Join Us for Community Forums on Curriculum Updates Assistant Superintendent for Instruction Melanie Ward will be sharing the NYSED Culturally Responsive-Sustaining Framework and recent updates to Pittsford’s K-12 English/language arts and social studies curriculum at the following events: Elementary Curriculum Review for Grades K-5 TOMORROW, August 24, 6:30-7:30pm at Calkins Road Middle School, commons Secondary Curriculum Review for Grades 6-12 Thursday, August 26, 6:30-7:30pm at Calkins Road Middle School, commons Culturally Responsive-Sustaining Education is not the same as Critical Race Theory Culturally Responsive-Sustaining Education is a research-based, NYSED required approach to how we interact in the classroom, in an attempt to connect with each student and help create an environment where everyone reaches their full potential. Critical Race Theory is a term that is being used a lot recently, but is not being taught in our schools. Critical Race Theory is about challenging historical approaches to the teaching of topics connected to race. It is a social and legal construct, typically discussed in university settings. Join us to learn more about the NYSED framework and PCSD curriculum updates by registering here: https://www.pittsfordschools.org/Page/25783. ASL interpretation services will be provided during the events. The forums will be recorded and posted on the PCSD YouTube page.",https://www.pittsfordschools.org/Page/25783,NA,NA,Curriculum & Instruction / Parent Forums on Curriculum Updates,Assistant Superintendent for Instruction Melanie Ward will be sharing the NYSED Culturally Responsive-Sustaining Framework and recent updates to Pittsford’s K-12 English/language arts and social studies curriculum at the following events: ,NA,NA,NA,-0.76,FALSE,TRUE
Pittsford Central School District,PittsfordCentralSchoolDistrict,185850194793977,PUBLIC_SCHOOL,US,The official Facebook page of the Pittsford Central School District.,2011-04-19T15:09:36Z,2514,2855,2021-08-20 07:55:02 EDT,2021-08-20,07:55:02,Link,5,1,3,1,0,0,0,0,0,0,NA,-,0,0,0,N/A,https://www.facebook.com/185850194793977/posts/4219325594779730,"Join Us for Community Forums on Curriculum Updates Assistant Superintendent for Instruction Melanie Ward will be sharing the NYSED Culturally Responsive-Sustaining Framework and recent updates to Pittsford’s K-12 English/language arts and social studies curriculum at the following events: Elementary Curriculum Review for Grades K-5 Tuesday, August 24, 6:30-7:30pm at Calkins Road Middle School, commons Secondary Curriculum Review for Grades 6-12 Thursday, August 26, 6:30-7:30pm at Calkins Road Middle School, commons Culturally Responsive-Sustaining Education is not the same as Critical Race Theory Culturally Responsive-Sustaining Education is a research-based, NYSED required approach to how we interact in the classroom, in an attempt to connect with each student and help create an environment where everyone reaches their full potential. Critical Race Theory is a term that is being used a lot recently, but is not being taught in our schools. Critical Race Theory is about challenging historical approaches to the teaching of topics connected to race. It is a social and legal construct, typically discussed in university settings. Join us to learn more about the NYSED framework and PCSD curriculum updates by registering here: https://www.pittsfordschools.org/Page/25783. ASL interpretation services will be provided during the events. The forums will be recorded and posted on the PCSD YouTube page.",https://www.pittsfordschools.org/Page/25783,NA,NA,Curriculum & Instruction / Parent Forums on Curriculum Updates,Assistant Superintendent for Instruction Melanie Ward will be sharing the NYSED Culturally Responsive-Sustaining Framework and recent updates to Pittsford’s K-12 English/language arts and social studies curriculum at the following events: ,NA,NA,NA,-0.71,FALSE,TRUE
Pittsford Central School District,PittsfordCentralSchoolDistrict,185850194793977,PUBLIC_SCHOOL,US,The official Facebook page of the Pittsford Central School District.,2011-04-19T15:09:36Z,2513,2854,2021-08-19 08:52:40 EDT,2021-08-19,08:52:40,Status,14,7,0,6,1,0,0,0,0,0,NA,-,0,0,0,N/A,https://www.facebook.com/185850194793977/posts/4216383891740567,"Join Us for Community Forums on Curriculum Updates Assistant Superintendent for Instruction Melanie Ward will be sharing the NYSED Culturally Responsive-Sustaining Framework and recent updates to Pittsford’s K-12 English/language arts and social studies curriculum at the following events: Elementary Curriculum Review for Grades K-5 Tuesday, August 24, 6:30-7:30pm at Calkins Road Middle School, commons Secondary Curriculum Review for Grades 6-12 Thursday, August 26, 6:30-7:30pm at Calkins Road Middle School, commons Culturally Responsive-Sustaining Education is not the same as Critical Race Theory Culturally Responsive-Sustaining Education is a research-based, NYSED required approach to how we interact in the classroom, in an attempt to connect with each student and help create an environment where everyone reaches their full potential. Critical Race Theory is a term that is being used a lot recently, but is not being taught in our schools. Critical Race Theory is about challenging historical approaches to the teaching of topics connected to race. It is a social and legal construct, typically discussed in university settings. Join us to learn more about the NYSED framework and PCSD curriculum updates by registering here: https://www.pittsfordschools.org/Page/25783. ASL interpretation services will be provided during the events. The forums will be recorded and posted on the PCSD YouTube page.",NA,NA,NA,NA,NA,NA,NA,NA,-2,FALSE,TRUE
Elizabethtown Area School District,etownschools,137748559605428,PUBLIC_SCHOOL,US,The Official Facebook Page of the Elizabethtown Area School District.,2010-09-27T15:10:13Z,4531,4854,2021-08-13 16:05:30 EDT,2021-08-13,16:05:30,Photo,87,40,29,8,7,0,0,2,1,0,NA,-,0,0,0,N/A,https://www.facebook.com/137748559605428/posts/4267988433248066,"To discourage rumors and correct misunderstandings, EASD has published more detailed information on Monday evening's Leader In Me Equity In Education Parent/Guardian Night. Parents and guardians are critical stakeholders in our education system. As such, the Equity In Education program is for the adults connected to our students and is designed to equip you with information to help build student leadership capacity. The Leader In Me Equity In Education program is neither a curriculum for students nor is it Critical Race Theory. For clarification purposes, Critical Race Theory IS NOT taught in our schools K-12. Instead, the purpose of the Equity in Education program is to ensure our schools feel safe and are conducive to learning for every student. Read more at ⬇️ https://tinyurl.com/442u9nhu:=:https://www.etownschools.org/site/default.aspx?PageType=3&DomainID=1&ModuleInstanceID=18544&ViewID=6446EE88-D30C-497E-9316-3F8874B3E108&RenderLoc=0&FlexDataID=35330&PageID=1",https://www.facebook.com/etownschools/photos/a.703330519713893/4267986559914920/?type=3,NA,-UPDATE LeaderinMe Equity In Education Parent/Guardian Night August 16 at 6 PM,NA,NA,NA,NA,NA,2.02,FALSE,TRUE
La Grande School District,NA,272963731358,PUBLIC_SCHOOL,US,"La Grande School District is located in La Grande, Oregon, nestled in the beautiful Grande Ronde valley. We have a total student population of about 2200 students. Please see our Social Media Terms of Use at: https://5il.co/qb8e",2010-01-26T23:17:37Z,2044,2295,2021-08-13 14:53:58 EDT,2021-08-13,14:53:58,Live Video Complete,6,5,0,1,0,0,0,0,0,0,share,No,204,1914,0,01:03:56,https://www.facebook.com/272963731358/posts/10158986166796359,"EO Alive Talked with LGSD's Superintendent George Mendoza and Scott Carpenter this morning 8/13/21. Hot topics discussed were: wearing masks in schools, critical race theory, and essential skills requirements. https://www.facebook.com/EOAliveTV/videos/426189615365140/",https://www.facebook.com/EOAliveTV/videos/426189615365140/,NA,NA,EOAlive.TV,EOTalks with LGSD's Superintendent George Mendoza and Scott Carpenter 8/13/21,NA,NA,NA,-4.17,FALSE,TRUE
