page_name,user_name,facebook_id,page_category,page_admin_top_country,page_description,page_created,likes_at_posting,followers_at_posting,post_created,post_created_date,post_created_time,type,total_interactions,likes,comments,shares,love,wow,haha,sad,angry,care,video_share_status,is_video_owner,post_views,total_views,total_views_for_all_crossposts,video_length,url,message,link,final_link,image_text,link_text,description,sponsor_id,sponsor_name,sponsor_category,overperforming_score_weighted_likes_1x_shares_1x_comments_1x_love_1x_wow_1x_haha_1x_sad_1x_angry_1x_care_1x,message_contains_crt,message_contains_critical_race_theory
Great Oaks Legacy Charter School,GreatOaksLegacyCharterSchool,208940935941002,MIDDLE_SCHOOL,US,"Great Oaks Charter School is a free, college-prep public charter school in Newark, NJ. Our mission is to make sure every student successfully enrolls in and graduates from a four year university. We currently serve grades PK4 - 12th grade.",2013-09-03T13:00:57Z,2247,2351,2021-02-08 14:30:01 EST,2021-02-08,14:30:01,Photo,3,3,0,0,0,0,0,0,0,0,NA,-,0,0,0,N/A,https://www.facebook.com/208940935941002/posts/1825057984329281,"Scholar and historian, Ibram X. Kendi is best known for his work at the forefront of anti-racist theory. The New York Times has dubbed his 2019 work, How to Be an Antiracist (2019), “the most courageous book to date on the problem of race...” Kendi combines his own life experiences with examinations of ethics, history, law, etc. An outspoken critic of systemic racism and police brutality, he calls upon readers to explore their own implicit beliefs and biases. Ibram X. Kendi award-winning work has led to being a visiting professor at Brown University, and a postdoctoral fellow at the Rutgers Center for Historical Analysis. _ #blackhistorymonth #blackhistorymonth2021 #blackhistory #greatoakslegacy #greatoaks #middleschool #highschool #elementary #preschool #enroll #newarkschools #tutorprogram #ibramxkendi #ibramkendi #kendi #rutgers #howtobeanantiracist #antiracist #criticalracetheory #racialjustice #allyship #crt #newyorktimes #nyt #history #law #educateyourself #amplifymelantedvoices #lifteveryvoice #blm",https://www.facebook.com/GreatOaksLegacyCharterSchool/photos/a.209411905893905/1825057957662617/?type=3,NA,BLACK HISTORY: Expanding Knowledge Ibram X. Kendi GREAT OAKS LEGACY CHARTER SCHOOL greatoakslegacy.org,NA,NA,NA,NA,NA,-0.73,TRUE,FALSE
Western School of Science and Technology: A Challenge Foundation Academy,westerntech,146815178861752,MIDDLE_SCHOOL,NA,"Become a part of Western CFA. Contact us now for enrollment and employment opportunities. www.western.teamcfa.school
https://www.youtube.com/watch?v=xHh8g",2013-09-16T22:06:52Z,893,936,2021-02-08 10:45:36 EST,2021-02-08,10:45:36,Photo,2,2,0,0,0,0,0,0,0,0,NA,-,0,0,0,N/A,https://www.facebook.com/146815178861752/posts/1527934130749843,"#BlackHistoryMonth Kimberlé Williams Crenshaw is an American lawyer, civil rights advocate, philosopher, and a leading scholar of critical race theory who developed the theory of intersectionality. She is a full-time professor at the UCLA School of Law and Columbia Law School, where she specializes in race and gender issues. Crenshaw is also the founder of Columbia Law School's Center for Intersectionality and Social Policy Studies (CISPS) and the African American Policy Forum (AAPF), as well as the president of the Berlin-based Center for Intersectional Justice (CIJ). Crenshaw is known for the introduction and development of intersectionality, the theory of how overlapping or intersecting social identities, particularly minority identities, relate to systems and structures of oppression, domination, or discrimination. Her scholarship was also essential in the development of intersectional feminism which examines the overlapping systems of oppression and discrimination to which women are subject due to their ethnicity, sexuality, and economic background. #BlackHistoryMonth #VamosWarriors",https://www.facebook.com/westerntech/photos/a.228071120736157/1527933777416545/?type=3,NA,"""THE POINT OF FEMINISM IS YOU SHOUL HAVE TO BE A MAN TO BE TREATED WITH EQUAL RESPECT."" WESTERN SCHOOLo Kimberlé Williams Crenshaw, American Lawyer",NA,NA,NA,NA,NA,-0.88,FALSE,TRUE
Creekside Charter Academy,CreeksideCharterAcademy,902810579877530,ELEMENTARY_SCHOOL,US,"Creekside Charter Academy is a tuition-free public charter school, welcoming students for the 2021-2022 school year. The school offers education for students in grades K-8th. Come Join us! 

""RECOGNIZING THE BRILLIANCE IN EVERY CHILD""",2017-11-01T14:23:30Z,914,984,2021-02-04 12:07:28 EST,2021-02-04,12:07:28,Photo,6,5,0,0,1,0,0,0,0,0,NA,-,0,0,0,N/A,https://www.facebook.com/902810579877530/posts/1865591533599425,Please join us for our next parent university hosted by our CRT Mrs. Reynolds. We will be discussing our schools AVID program and how it enhances our students education.,https://www.facebook.com/CreeksideCharterAcademy/photos/a.1022276717930915/1865585436933368/?type=3,NA,"CREEKSIDE CHARTER ACADEMY AVID PARENT WORKSHOP KINDERGARTEN- 8TH GRADE PARENT UNIVERSITY Session 2 Join for OUI next Parent University and learn more about the AVID Program. Our session will include overview the program and what implementation looks like currently here at Creekside Charter Academy! WEDNESDAY, FEBRUARY 17TH @ 4:30 PM Join Zoom Meeting Here AVID Proven Achievement. Lifelong Advantage.",NA,NA,NA,NA,NA,-4.33,TRUE,FALSE
Explore Schools,ExploreSchoolsBrooklyn,486232741860938,EDUCATION_COMPANY,US,Explore Schools is a network of public charter schools in educationally under-served communities in Brooklyn.,2018-11-07T16:05:11Z,511,528,2020-12-16 14:16:07 EST,2020-12-16,14:16:07,Photo,0,0,0,0,0,0,0,0,0,0,NA,-,0,0,0,N/A,https://www.facebook.com/486232741860938/posts/1016048268879380,"The Explore Schools Recruitment Team is hosting ""Introduction to Explore Schools"" webinars to connect with prospective candidates between now and June 2021. Sign up today, or share this with a friend who is interested in joining our community of dedicated educators doing transformative work! See the link in our bio, or here: https://exploreschoolswebinars.app.rsvpify.com/ #ExploreOpportunity #spreadtheword . . . #exploreschools #charterschools #brooklyncharters #education #educationalwebinar #hiring #educationopportunities #teacheropportunities #leadershipopportunities #iteachtoo #iteachmath #iteachsped #iteachela #iteachscience #specialeducationteacher #recruitingnow #signupnow #communityschools #culturallyresponsiveteaching #studentempowerment #traumainformedteachingpractices",https://www.facebook.com/ExploreSchoolsBrooklyn/photos/a.502115986939280/1016048242212716/?type=3,https://www.facebook.com/login/?next=https%3A%2F%2Fwww.facebook.com%2FExploreSchoolsBrooklyn%2Fphotos%2Fa.502115986939280%2F1016048242212716%2F%3Ftype%3D3,"INTRODUCTION TO EXPLORE SCHOOLS WEBINARS EXCEED LEARN MORE about the ransformative work our community students, educators, parents and families are doing! Get sense of: Our culturally responsive approach to education and trauma-informed trauma-i practices Our commitment being an anti-white supremacy organization Opportunitiesfor growth at our organization And more! Topics covered in separate webinars: Approach to Math Instruction Culturally Responsive Teaching (CRT) Approacht Special Education Operations Opportunities Student Culture rauma-Informed Practices Webinars are hour, with dates between December 2020 to June 2021 RSVP HERE TODAY- h:sy.cm Explore Schools",NA,NA,NA,NA,NA,-8,FALSE,FALSE
Rockwood South Middle School,RockwoodSouthMiddle,1628187194108002,MIDDLE_SCHOOL,NA,This is the official page of Rockwood South Middle School,2015-10-01T18:53:05Z,776,781,2020-12-10 11:22:09 EST,2020-12-10,11:22:09,Photo,0,0,0,0,0,0,0,0,0,0,NA,-,0,0,0,N/A,https://www.facebook.com/1628187194108002/posts/2769399849986725,https://twitter.com/ashleyOD_SW/status/1337053345589161985 https://twitter.com/OfficeRsms/status/1337064810865897473,https://www.facebook.com/RockwoodSouthMiddle/photos/a.1628195107440544/2769399699986740/?type=3,https://www.facebook.com/login/?next=https%3A%2F%2Fwww.facebook.com%2Flogin%2F%3Fnext%3Dhttps%253A%252F%252Fwww.facebook.com%252Flogin%252F%253Fnext%253Dhttps%25253A%25252F%25252Fwww.facebook.com%25252Flogin%25252F%25253Fnext%25253Dhttps%2525253A%2525252F%2525252Fwww.facebook.com%2525252Flogin%2525252F%2525253Fnext%2525253Dhttps%252525253A%252525252F%252525252Fwww.facebook.com%252525252Flogin%252525252F%252525253Fnext%252525253Dhttps%25252525253A%25252525252F%25252525252Fwww.facebook.com%25252525252Flogin%25252525252F%25252525253Fnext%25252525253Dhttps%2525252525253A%2525252525252F%2525252525252Fwww.facebook.com%2525252525252Flogin%2525252525252F%2525252525253Fnext%2525252525253Dhttps%252525252525253A%252525252525252F%252525252525252Fwww.facebook.com%252525252525252Flogin%252525252525252F%252525252525253Fnext%252525252525253Dhttps%25252525252525253A%25252525252525252F%25252525252525252Fwww.facebook.com%25252525252525252Flogin%25252525252525252F%25252525252525253Fnext%25252525252525253Dhttps%2525252525252525253A%2525252525252525252F%2525252525252525252Fwww.facebook.com%2525252525252525252FRockwoodSouthMiddle%2525252525252525252Fphotos%2525252525252525252Fa.1628195107440544%2525252525252525252F2769399699986740%2525252525252525252F%2525252525252525253Ftype%2525252525252525253D3,"Ashley O'Daniel @ashleyOD_SW 90ම Shout out to Angela Winkler for continuing to volunteer her time and talents by providing haircuts for our students in need! Please show her some love and reach out to her for all your hair styling needs she's amazing! #RSMSrocks @RSMS_PSO @RSMSPrincipal Angela Winkler Allusion Salon Aveda Concept 11133 Lindbergh Bus, Crt. St.louis.Mo63123 t.louis,Mo allusionsstl com OR www veda.com/salon/AllusionsSTL AllusionsSTL 2017977text (314)0032003 call 2003 9:15 AM Dec 10, 2020 Twitter Web App 2 Retweets 2 Quote Tweets 4 Likes い Dr. Birkenmeier @RSMSPrincipal 21m Replying to @ashleyOD_SW and @RSMS_PSO Angela the best!!! 606",Photos from Rockwood South Middle School's post,NA,NA,NA,NA,-20,FALSE,FALSE
Explore Schools,ExploreSchoolsBrooklyn,486232741860938,EDUCATION_COMPANY,US,Explore Schools is a network of public charter schools in educationally under-served communities in Brooklyn.,2018-11-07T16:05:11Z,512,529,2020-11-30 17:38:46 EST,2020-11-30,17:38:46,Photo,2,2,0,0,0,0,0,0,0,0,NA,-,0,0,0,N/A,https://www.facebook.com/486232741860938/posts/1005206926630181,"The Explore Schools Recruitment Team is hosting webinars beginning this week! We're excited to connect with prospective candidates to share more about the transformative work we do, and opportunities within our network! Sign up TODAY! ➡️ https://exploreschoolswebinars.app.rsvpify.com/ (or see link in bio) #spreadtheword . . . #exploreschools #charterschools #brooklyncharters #education #educationwebinar #educationalwebinar #educationopportunities #teacheropportunities #hiring #leadershipopportunities #cultureopportunities #operationsopportunity #supportservices #iteachtoo #iteachmath #iteachsped #iteachela #iteachscience #specialeducationteachers #recruitingnow #hiringseason #signupnow #communityschools #culturallyresponsiveteaching #traumainformedteachingpractices",https://www.facebook.com/ExploreSchoolsBrooklyn/photos/a.501463823671163/1005206896630184/?type=3,https://www.facebook.com/login/?next=https%3A%2F%2Fwww.facebook.com%2Flogin%2F%3Fnext%3Dhttps%253A%252F%252Fwww.facebook.com%252Flogin%252F%253Fnext%253Dhttps%25253A%25252F%25252Fwww.facebook.com%25252Flogin%25252F%25253Fnext%25253Dhttps%2525253A%2525252F%2525252Fwww.facebook.com%2525252Flogin%2525252F%2525253Fnext%2525253Dhttps%252525253A%252525252F%252525252Fwww.facebook.com%252525252Flogin%252525252F%252525253Fnext%252525253Dhttps%25252525253A%25252525252F%25252525252Fwww.facebook.com%25252525252Flogin%25252525252F%25252525253Fnext%25252525253Dhttps%2525252525253A%2525252525252F%2525252525252Fwww.facebook.com%2525252525252Flogin%2525252525252F%2525252525253Fnext%2525252525253Dhttps%252525252525253A%252525252525252F%252525252525252Fwww.facebook.com%252525252525252Flogin%252525252525252F%252525252525253Fnext%252525252525253Dhttps%25252525252525253A%25252525252525252F%25252525252525252Fwww.facebook.com%25252525252525252Flogin%25252525252525252F%25252525252525253Fnext%25252525252525253Dhttps%2525252525252525253A%2525252525252525252F%2525252525252525252Fwww.facebook.com%2525252525252525252FExploreSchoolsBrooklyn%2525252525252525252Fphotos%2525252525252525252Fa.501463823671163%2525252525252525252F1005206896630184%2525252525252525252F%2525252525252525253Ftype%2525252525252525253D3,"INTRODUCTION TO EXPLORE SCHOOLS WEBINARS THE TUFF ASTIAS LEARN MORE about the transformative work our comm community students, educators, parents and families are doing! Get sense of: Our culturally responsive approach to education and trauma-informed practices Our commitment being an anti-white supremacy organization Opportunities growth And more! Topics covered in separate webinars: Approac to Math Instruction Culturally Responsive Teaching (CRT) Approach Special Education our organization Webinars are hour, with dates between December 2020 to June 2021 RSVP HERE TODAY h/.m Operations Opportunities Student Culture Trauma-Informed Practices Explore Schools",NA,NA,NA,NA,NA,-0.5,FALSE,FALSE
"Cherokee County, Georgia",CherokeeCountyGa,100064625116339,PERSON,US,"Welcome to the official Facebook page for the Cherokee County, Georgia government! Please see our So",2009-03-09T21:34:18Z,16581,18822,2020-11-25 15:05:48 EST,2020-11-25,15:05:48,Link,17,10,7,0,0,0,0,0,0,0,NA,-,0,0,0,N/A,https://www.facebook.com/82057741176/posts/399967834457949,NA,https://www.facebook.com/events/399967834457949/,NA,NA,Electronics Recycling Event,"The Cherokee County Recycling Center in partnership with Premier Surplus, Inc. is hosting an electronics recycling event Dec. 5, from 9 a.m. to 1 p.m., at the County Administration Building, 1130 Bluffs Parkway, Canton.

Items accepted at no charge include personal computers, laptops, modems, floppy/disk drives, printers, UPS batteries, CD-ROMS, fax machines, cell phones, circuit boards, copiers, phones, PC power supplies, stereos/VCR/CD players, scanners, keyboards, typewriters, toner cartridges, mouse/mice, text equipment, wire/cabling, PC monitors, and networking equipment.

Televisions are accepted for a $20 fee. CRT monitors are $5 each, and large projection TVs are $40.

Items not accepted are wooden cabinet tv sets, gas-powered equipment, tires, household/alkaline batteries, household trash and appliances.

This is a drive-through event. People should remain in their car, and volunteers will take all equipment from the vehicle. Please remove any equipment from boxes and cables from each device. All cables may be placed in a bag for drop off that day.

For more information, call the Recycling Center at 770-516-4195 or Premier Surplus at 706-525-3050.",NA,NA,NA,-2.35,NA,NA
PM Wells Charter Academy,PMWellsCharterAcademy,1000308456662339,ELEMENTARY_SCHOOL,US,Lowest grade taught: Kindergarten - Highest grade taught: 8th Grade,2014-11-20T21:16:12Z,704,748,2020-11-19 12:54:39 EST,2020-11-19,12:54:39,Photo,1,1,0,0,0,0,0,0,0,0,NA,-,0,0,0,N/A,https://www.facebook.com/1000308456662339/posts/4187476441278842,"Our CRT and teachers in grades 4-8 are learning how to use ⁦ @usatestprep to supplement science instruction. Thank you, Haley for your help! #science #CSUSAproud",https://www.facebook.com/PMWellsCharterAcademy/photos/a.1856822427677600/4187475731278913/?type=3,https://www.facebook.com/login/?next=https%3A%2F%2Fwww.facebook.com%2Flogin%2F%3Fnext%3Dhttps%253A%252F%252Fwww.facebook.com%252Flogin%252F%253Fnext%253Dhttps%25253A%25252F%25252Fwww.facebook.com%25252Flogin%25252F%25253Fnext%25253Dhttps%2525253A%2525252F%2525252Fwww.facebook.com%2525252Flogin%2525252F%2525253Fnext%2525253Dhttps%252525253A%252525252F%252525252Fwww.facebook.com%252525252Flogin%252525252F%252525253Fnext%252525253Dhttps%25252525253A%25252525252F%25252525252Fwww.facebook.com%25252525252Flogin%25252525252F%25252525253Fnext%25252525253Dhttps%2525252525253A%2525252525252F%2525252525252Fwww.facebook.com%2525252525252Flogin%2525252525252F%2525252525253Fnext%2525252525253Dhttps%252525252525253A%252525252525252F%252525252525252Fwww.facebook.com%252525252525252Flogin%252525252525252F%252525252525253Fnext%252525252525253Dhttps%25252525252525253A%25252525252525252F%25252525252525252Fwww.facebook.com%25252525252525252Flogin%25252525252525252F%25252525252525253Fnext%25252525252525253Dhttps%2525252525252525253A%2525252525252525252F%2525252525252525252Fwww.facebook.com%2525252525252525252FPMWellsCharterAcademy%2525252525252525252Fphotos%2525252525252525252Fa.1856822427677600%2525252525252525252F4187475731278913%2525252525252525252F%2525252525252525253Ftype%2525252525252525253D3,NA,Photos from PM Wells Charter Academy's post,NA,NA,NA,NA,-30,TRUE,FALSE
Perry High School -Lake County Ohio,NA,108142665955951,HIGH_SCHOOL,US,Perry High School is located in Lake County Ohio. It is the home of the Perry Pirates.,2011-08-24T23:10:19Z,3019,3399,2020-11-10 11:46:55 EST,2020-11-10,11:46:55,Photo,13,13,0,0,0,0,0,0,0,0,NA,-,0,0,0,N/A,https://www.facebook.com/108142665955951/posts/2821901037913420,NA,https://www.facebook.com/104487414318731/photos/a.104518210982318/374972317270238/?type=3,NA,NA,Guidance and Counseling at Perry HS,"Both interns, Anna and Mary, are getting a first-hand experience with the business world from accounting to Human Resources. 👍🏼 Thanks so much, CRT and Cleveland Construction Company!!!",NA,NA,NA,-3.38,NA,NA
Putnam County School District,PutnamCountySchoolsFL,750901598333028,COMMUNITY,US,"Official Facebook page for the Putnam County, Florida, Public School District",2015-01-04T22:19:45Z,7527,7982,2020-11-04 15:12:00 EST,2020-11-04,15:12:00,Photo,358,118,77,72,89,0,0,0,0,2,NA,-,0,0,0,N/A,https://www.facebook.com/750901598333028/posts/3395742030515625,"The Putnam County School District is pleased to announce Yolanda Brady as the PCSD Assistant Principal of the Year for 2020-2021! Yolanda is a product of the South Putnam community as a graduate from Crescent City High School. After receiving her education credentials, she came back to South Putnam to serve our community and raise her family. She has worked in the capacity of ESE teacher, reading teacher, CRT, guidance counselor, TOSA, and assistant principal. Under her leadership, the achievement of all subgroups in South Putnam has increased. She continues to place an emphasis on academic achievement and opportunities for all students in Putnam County, and we are so proud to recognize her for her efforts on behalf of our community! #ProudtobePCSD",https://www.facebook.com/PutnamCountySchoolsFL/photos/a.785755471514307/3395742030515625/?type=3,NA,NA,Timeline photos,NA,NA,NA,NA,5.87,TRUE,FALSE
"Union Public Schools - Tulsa, OK",UnionSchools,177939366689,PUBLIC_SCHOOL,US,"Education Service Center Address
8506 E. 61st Street-
Tulsa, OK 74133-1926

Union Enrollment Center
6011 S. 89 E. Ave
Tulsa, OK
",2009-10-08T03:50:56Z,17061,17300,2020-10-29 15:53:28 EDT,2020-10-29,15:53:28,Photo,16,8,0,2,6,0,0,0,0,0,NA,-,0,0,0,N/A,https://www.facebook.com/177939366689/posts/10158418849521690,NA,https://www.facebook.com/UHSFreshmanAcademy/photos/a.350537932550560/698649591072724/?type=3,NA,NA,UHS Freshman Academy,"Pre-AP Geometry teacher Diane Thomas needed something to keep her students learning about proofs,.

""They hate proofs,"" she admitted, ""but ""all of my classes continually talked about this 'Among Us' game, so I asked them to help me come up with a classroom version.""

She said, ""We used the conference room to create areas that kids go into to complete their task cards before being turned into ghosts by the impostors. It was challenging coming up with the sabotages and venting halls to imitate the game, but with two days of working through the kinks, we got the closest version of Among Us in real life. We hope to keep the room built so other teachers can utilize it and so we can return for CRT reviews.""

Chris Sharpe, who works in Union's IT Department, said, """"Taking Among Us and making it into a solution for the students and engaging them! Brilliant!""",NA,NA,NA,-2.5,NA,NA
Porterville Unified School District,PortervilleUnified,961348247220658,SCHOOL,US,The official Facebook page for the Porterville Unified School District.,2015-10-07T19:30:02Z,9545,10160,2020-10-28 13:19:49 EDT,2020-10-28,13:19:49,Photo,1,1,0,0,0,0,0,0,0,0,NA,-,0,0,0,N/A,https://www.facebook.com/961348247220658/posts/3449074818447976,NA,https://www.facebook.com/SQFComplexTulareCounty/photos/a.120101786518249/133380321857062/?type=3,NA,NA,Tulare County Recovers -SQF Complex Fire,"Phase one Debris Removal for residents affected by the sqf complex fire begins November 3
Phase one includes toxic substances and household hazardous waste
 
VISALIA, CA – The Department of Toxic Substances Control (DTSC) is working with the County Resource Management Agency, the Environmental Health Division, and other County officials to begin phase one of the cleanup process on November 3 for residences damaged or destroyed by the SQF Complex, at no cost to property owners. 
 
This phase of debris-removal efforts includes the processing and disposal of household hazardous waste and toxic waste on-site at no cost to the property owner. The effort is expected to last three to four weeks, with work taking place Monday–Friday, but is dependent on available daylight, weather conditions, the amount of material to be removed, and other factors.
 
Disposal of hazardous waste ensures the public health of those returning to the area and prepares affected properties for phase two, which involves the more comprehensive removal of debris. Property owners who choose to begin property cleanup themselves outside of the federal process may lose out on federal funding but will still be subject to proper cleanup standards.
 
Crews will remove electronic waste, such as: microwave ovens; LCD, plasma, and CRT displays; stereo components; copiers; phones and answering machines; VCRs, DVD/Blu-Ray players, computers, laptops, and routers (home network equipment); and calculators.

Crews will also remove household hazardous wastes, including paint; pesticides; aerosol cans; fire extinguishers; pool chemicals; propane cylinders at or less than 30 gallons (e.g., BBQ tanks); intact compressed gas cylinders; ammunition smaller than .50 caliber; batteries; suspected asbestos-containing materials; and fluorescent light ballasts. 
 
County, state, and federal officials are actively working on the phase-two program. More details on phase two, including the required forms to participate in that phase, are expected in the coming days. Individuals with damaged or destroyed properties who have not yet contacted the County via the Local Assistance Center or SQF Complex Hotline are encouraged to do so. Affected individuals are also encouraged to register with FEMA by November 23 for potential federal assistance. 
 
For assistance, visit the local assistance center at 1055 W. Henderson in Porterville Monday–Friday 8:00 a.m.-5:00 p.m. and weekends 9:00 a.m.-3:00 p.m. or call the hotline at (559) 802-9790.

You can find out more information about phase-one debris cleanup at https://dtsc.ca.gov/erp/california-wildfire-cleanup-recovery-in-2020/ 
###",NA,NA,NA,-35,NA,NA
Cape Elizabeth Schools,capeelizabethschools,354934214660318,PUBLIC_SCHOOL,NA,"News and announcements from the Cape Elizabeth School Department, Cape Elizabeth, Maine",2014-08-05T21:11:29Z,1120,1289,2020-10-26 09:56:23 EDT,2020-10-26,09:56:23,Photo,4,2,0,1,1,0,0,0,0,0,NA,-,0,0,0,N/A,https://www.facebook.com/354934214660318/posts/1820282191458839,"Want to learn more about the CEMS Civil Rights Teams (CRT)? Please click below to read a brief introduction from Mrs. Royal and Mr. Werner, the CEMS CRT Advisors. http://bit.ly/CRTIntro2020:=:https://drive.google.com/file/d/1v0beDNrrUsARmomZpM-c4hSSMHDEmQdn/view?usp=sharing",https://www.facebook.com/capeelizabethschools/photos/a.402911943195878/1820282191458839/?type=3,NA,NA,Timeline Photos,NA,NA,NA,NA,-6.25,TRUE,FALSE
